{
  "schema_version": "1.0.0",
  "phase": "01",
  "status": "READY_FOR_HUMAN_REVIEW",
  "branch": "phase/01-foundations",
  "baseline_commit": "a4947c91584e5b6a538ce0f83418d1c21a4d559c",
  "commit": "86dea28e31bb02b35c001c2fa819718ecfd0b1ea",
  "changed_files": [
    {"path":".gitignore","change":"modified","allowlist_category":"MAY_MODIFY"},
    {"path":"PHASE_STATUS.md","change":"modified","allowlist_category":"MAY_MODIFY"},
    {"path":"backend/README.md","change":"modified","allowlist_category":"MAY_MODIFY"},
    {"path":"infra/README.md","change":"modified","allowlist_category":"MAY_MODIFY"},
    {"path":".env.example","change":"created","allowlist_category":"MAY_CREATE"},
    {"path":".github/workflows/ci.yml","change":"created","allowlist_category":"MAY_CREATE"},
    {"path":"Makefile","change":"created","allowlist_category":"MAY_CREATE"},
    {"path":"pyproject.toml","change":"created","allowlist_category":"MAY_CREATE"},
    {"path":"backend/alembic.ini","change":"created","allowlist_category":"MAY_CREATE"},
    {"path":"backend/alembic/env.py","change":"created","allowlist_category":"MAY_CREATE"},
    {"path":"backend/alembic/script.py.mako","change":"created","allowlist_category":"MAY_CREATE"},
    {"path":"backend/alembic/versions/0001_foundation.py","change":"created","allowlist_category":"MAY_CREATE"},
    {"path":"backend/app/api/__init__.py","change":"created","allowlist_category":"MAY_CREATE"},
    {"path":"backend/app/api/health.py","change":"created","allowlist_category":"MAY_CREATE"},
    {"path":"backend/app/audit/__init__.py","change":"created","allowlist_category":"MAY_CREATE"},
    {"path":"backend/app/audit/redaction.py","change":"created","allowlist_category":"MAY_CREATE"},
    {"path":"backend/app/authz/__init__.py","change":"created","allowlist_category":"MAY_CREATE"},
    {"path":"backend/app/authz/service.py","change":"created","allowlist_category":"MAY_CREATE"},
    {"path":"backend/app/config.py","change":"created","allowlist_category":"MAY_CREATE"},
    {"path":"backend/app/contracts/__init__.py","change":"created","allowlist_category":"MAY_CREATE"},
    {"path":"backend/app/contracts/foundation.py","change":"created","allowlist_category":"MAY_CREATE"},
    {"path":"backend/app/db/__init__.py","change":"created","allowlist_category":"MAY_CREATE"},
    {"path":"backend/app/db/engine.py","change":"created","allowlist_category":"MAY_CREATE"},
    {"path":"backend/app/db/health.py","change":"created","allowlist_category":"MAY_CREATE"},
    {"path":"backend/app/errors.py","change":"created","allowlist_category":"MAY_CREATE"},
    {"path":"backend/app/events/__init__.py","change":"created","allowlist_category":"MAY_CREATE"},
    {"path":"backend/app/events/outbox.py","change":"created","allowlist_category":"MAY_CREATE"},
    {"path":"backend/app/events/service.py","change":"created","allowlist_category":"MAY_CREATE"},
    {"path":"backend/app/identity/__init__.py","change":"created","allowlist_category":"MAY_CREATE"},
    {"path":"backend/app/identity/auth0.py","change":"created","allowlist_category":"MAY_CREATE"},
    {"path":"backend/app/identity/fake.py","change":"created","allowlist_category":"MAY_CREATE"},
    {"path":"backend/app/identity/ports.py","change":"created","allowlist_category":"MAY_CREATE"},
    {"path":"backend/app/identity/provisioning.py","change":"created","allowlist_category":"MAY_CREATE"},
    {"path":"backend/app/identity/repository.py","change":"created","allowlist_category":"MAY_CREATE"},
    {"path":"backend/app/identity/session.py","change":"created","allowlist_category":"MAY_CREATE"},
    {"path":"backend/app/identity/session_store.py","change":"created","allowlist_category":"MAY_CREATE"},
    {"path":"backend/app/logging.py","change":"created","allowlist_category":"MAY_CREATE"},
    {"path":"backend/app/main.py","change":"created","allowlist_category":"MAY_CREATE"},
    {"path":"backend/tests/conftest.py","change":"created","allowlist_category":"MAY_CREATE"},
    {"path":"backend/tests/contract/execution/test_phase_result_schema.py","change":"created","allowlist_category":"MAY_CREATE"},
    {"path":"backend/tests/contract/foundation/test_contract_versions.py","change":"created","allowlist_category":"MAY_CREATE"},
    {"path":"backend/tests/fixtures/contracts/foundation-v1.json","change":"created","allowlist_category":"MAY_CREATE"},
    {"path":"backend/tests/fixtures/execution/phase-results.json","change":"created","allowlist_category":"MAY_CREATE"},
    {"path":"backend/tests/fixtures/foundation/db-roles.yaml","change":"created","allowlist_category":"MAY_CREATE"},
    {"path":"backend/tests/fixtures/foundation/empty-postgres.yaml","change":"created","allowlist_category":"MAY_CREATE"},
    {"path":"backend/tests/fixtures/foundation/idempotent-write.json","change":"created","allowlist_category":"MAY_CREATE"},
    {"path":"backend/tests/fixtures/foundation/protected-mutation.json","change":"created","allowlist_category":"MAY_CREATE"},
    {"path":"backend/tests/fixtures/foundation/two-tenants.json","change":"created","allowlist_category":"MAY_CREATE"},
    {"path":"backend/tests/fixtures/security/fake-secret.json","change":"created","allowlist_category":"MAY_CREATE"},
    {"path":"backend/tests/integration/foundation/support.py","change":"created","allowlist_category":"MAY_CREATE"},
    {"path":"backend/tests/integration/foundation/test_atomic_write.py","change":"created","allowlist_category":"MAY_CREATE"},
    {"path":"backend/tests/integration/foundation/test_idempotency.py","change":"created","allowlist_category":"MAY_CREATE"},
    {"path":"backend/tests/integration/foundation/test_outbox.py","change":"created","allowlist_category":"MAY_CREATE"},
    {"path":"backend/tests/integration/foundation/test_readiness.py","change":"created","allowlist_category":"MAY_CREATE"},
    {"path":"backend/tests/security/foundation/test_append_only.py","change":"created","allowlist_category":"MAY_CREATE"},
    {"path":"backend/tests/security/foundation/test_db_roles.py","change":"created","allowlist_category":"MAY_CREATE"},
    {"path":"backend/tests/security/foundation/test_provisioning.py","change":"created","allowlist_category":"MAY_CREATE"},
    {"path":"backend/tests/security/foundation/test_redaction.py","change":"created","allowlist_category":"MAY_CREATE"},
    {"path":"backend/tests/security/foundation/test_session_store.py","change":"created","allowlist_category":"MAY_CREATE"},
    {"path":"backend/tests/security/foundation/test_state_integrity.py","change":"created","allowlist_category":"MAY_CREATE"},
    {"path":"backend/tests/security/foundation/test_tenant_isolation.py","change":"created","allowlist_category":"MAY_CREATE"},
    {"path":"backend/tests/unit/foundation/test_canonicalization.py","change":"created","allowlist_category":"MAY_CREATE"},
    {"path":"backend/tests/unit/foundation/test_config.py","change":"created","allowlist_category":"MAY_CREATE"},
    {"path":"backend/tests/unit/foundation/test_health.py","change":"created","allowlist_category":"MAY_CREATE"},
    {"path":"backend/tests/unit/foundation/test_identity_authz.py","change":"created","allowlist_category":"MAY_CREATE"},
    {"path":"backend/tests/unit/foundation/test_migration_guard.py","change":"created","allowlist_category":"MAY_CREATE"},
    {"path":"backend/tests/unit/foundation/test_session.py","change":"created","allowlist_category":"MAY_CREATE"},
    {"path":"docs/execplans/phase-01.md","change":"created","allowlist_category":"MAY_CREATE"},
    {"path":"infra/compose.yaml","change":"created","allowlist_category":"MAY_CREATE"},
    {"path":"infra/postgres/init/001-local-roles.sql","change":"created","allowlist_category":"MAY_CREATE"},
    {"path":"scripts/codex/migration_check.py","change":"created","allowlist_category":"MAY_CREATE"},
    {"path":"scripts/codex/run_phase01_validation.py","change":"created","allowlist_category":"MAY_CREATE"},
    {"path":"scripts/codex/validate_phase_result.py","change":"created","allowlist_category":"MAY_CREATE"},
    {"path":"artifacts/validation/phase-01/REVIEW.md","change":"created","allowlist_category":"MAY_CREATE"},
    {"path":"artifacts/validation/phase-01/codex-result.json","change":"created","allowlist_category":"MAY_CREATE"},
    {"path":"artifacts/validation/phase-01/changed-files.txt","change":"created","allowlist_category":"MAY_CREATE"},
    {"path":"artifacts/validation/phase-01/code-attempts.md","change":"created","allowlist_category":"MAY_CREATE"},
    {"path":"artifacts/validation/phase-01/phase-review.log","change":"created","allowlist_category":"MAY_CREATE"},
    {"path":"artifacts/validation/phase-01/automated-tests.log","change":"created","allowlist_category":"MAY_CREATE"},
    {"path":"artifacts/validation/phase-01/migration-check.log","change":"created","allowlist_category":"MAY_CREATE"},
    {"path":"artifacts/validation/phase-01/contract-tests.log","change":"created","allowlist_category":"MAY_CREATE"},
    {"path":"artifacts/validation/phase-01/security-tests.log","change":"created","allowlist_category":"MAY_CREATE"},
    {"path":"artifacts/validation/phase-01/reviewer.md","change":"created","allowlist_category":"MAY_CREATE"},
    {"path":"artifacts/validation/phase-01/test-audit.md","change":"created","allowlist_category":"MAY_CREATE"},
    {"path":"artifacts/validation/phase-01/security-review.md","change":"created","allowlist_category":"MAY_CREATE"},
    {"path":"artifacts/validation/phase-01/human-uat.md","change":"created","allowlist_category":"MAY_CREATE"}
  ],
  "commands": [
    {"command":"git status --short","attempt":10,"exit_code":0,"evidence_path":"artifacts/validation/phase-01/phase-review.log"},
    {"command":"git diff --check","attempt":10,"exit_code":0,"evidence_path":"artifacts/validation/phase-01/phase-review.log"},
    {"command":"docker compose -f infra/compose.yaml config","attempt":10,"exit_code":0,"evidence_path":"artifacts/validation/phase-01/phase-review.log"},